{"schema":"legacyforge-native-capability-receipt-v2","case_id":"D06-FMT01","source_commit":"bbe3a42c422e4328d5f98c07a9370fa948d0cbbf","build_id":"20261017-180047-9ad3700d","production_comparison_commit":"d1453434ceefe73bef5aff497194e09f39dde7e1","frozen_d00_reference_commit":"553c6554f40f1372b0ea09f6badbbb98e133a9ab","frozen_hw01_reference_commit":"a3f72874241914f6048d4ca9ec4fc0edc978625d","package_name":"AlgorHome.LegacyForge.NativeDiagnostics","package_publisher":"CN=LegacyForgeDiagnostics","package_version":"0.2.1.0","architecture":"x64","application_id":"App","expected_package_identity":true,"run_id":"D10A4D4B-45B4-4E67-972F-5B7A13675204","process_instance_id":"F55B2698-AF7B-4D48-A176-9B8DDCC6AA28","java_jni_enabled":false,"minecraft_or_gameplay_tested":false,"all_d06_certified":false,"hardware_device_requested":true,"watchdog_cancels_native_calls":false,"payload_hashes":{"executable_sha256":"eda70661b4f0ec6b7df6e08b81c8e42f7ee2f6f11acc8f3c3be69a5872f43de1","manifest_sha256":"593fbda9d0dce1ac6b6f12a96e187d5b1c2d0d4aaced9accdadb7cf806807fd0","build_inputs_sha256":"5cb62bbacce8b7000099f9432c285bbb71b8b3e26fd50876878f1db1a89cc21a","policy_sha256":"57f849c631ba5fd2de08e6d6eda593eccd81f7cba485212b99f7665b86f0a845","schema_sha256":"3373265fb3aa787a375e4edc1da54e4807793bf4151d645519d9c45b5cdbb6b7","inventory_sha256":"37cc66fcd8abd77fce39b6d488ac822e196ced3bf91cb1a7835ec90976d1f1b6"},"status":"PASS","reason":"RGBA8_REQUIRED_FORMAT_SUPPORT_CONFIRMED","stage":"FINAL","terminal":true,"sequence":4,"elapsed_monotonic_ms":63,"deadline_ms":10000,"observed_at_utc":"2026-10-17T23:15:01.858Z","last_durable_checkpoint_stage":"BEFORE_FORMAT_QUERY","receipt_persistence_result":"VERIFY_BY_RETRIEVAL","details":{"requested_driver_type":"HARDWARE","requested_driver_type_value":1,"requested_feature_level":45056,"creation_flags":32,"software_fallback_allowed":false,"render_or_present_tested":false,"format_name":"DXGI_FORMAT_R8G8B8A8_UNORM","format_value":28,"required_support_mask":16928,"query_attempted":true,"format_support_valid":true,"memory_before":{"usage_bytes":4931584,"limit_bytes":1073741824,"available":true},"creation_hresult":"0x00000000","creation_hresult_signed":0,"selected_feature_level":45056,"device_returned":true,"context_returned":true,"get_adapter_hresult":"0x00000000","get_desc_hresult":"0x00000000","adapter_flags":0,"adapter_software_flag":false,"query_hresult":"0x00000000","query_hresult_signed":0,"format_support_raw":872346611,"format_support_hex":"0x33FEF3F3","texture2d_supported":true,"shader_sample_supported":true,"render_target_supported":true,"mip_supported":true,"test_resources_released":true,"memory_after_release":{"usage_bytes":9904128,"limit_bytes":1073741824,"available":true}}}